{
  "case_id": "CASE-2026-0917-01",
  "listing_id": "L-700123",
  "opened_at": "2026-09-17T10:00:00+08:00",
  "status": "open",
  "signals": [
    {
      "signal_id": "SIG-1",
      "type": "listing_substitution",
      "detected_at": "2026-09-17T09:40:00+08:00",
      "summary": "订单 O-1004 履约时买家所见页面哈希与备案版本 lv-700123-01 不一致，疑似商品替换。",
      "order_ids": ["O-1004"]
    },
    {
      "signal_id": "SIG-2",
      "type": "duplicate_trace_code",
      "detected_at": "2026-09-19T08:55:00+08:00",
      "summary": "追溯码 T1003 在订单 O-1003 与 O-1005 重复出现，后者锁定批次为 B2026-08B，码却来自 B2026-07A 码段。",
      "order_ids": ["O-1003", "O-1005"]
    },
    {
      "signal_id": "SIG-3",
      "type": "trace_code_out_of_range",
      "detected_at": "2026-09-19T08:55:00+08:00",
      "summary": "订单 O-1005 使用追溯码 T9999，不在任一已报备采购批次码段内。",
      "order_ids": ["O-1005"]
    },
    {
      "signal_id": "SIG-4",
      "type": "expired_source_proof",
      "detected_at": "2026-09-02T07:00:00+08:00",
      "summary": "药品经营许可证 Q2 于 2026-08-31 到期，来源证明失效。",
      "qual_ids": ["Q2"]
    },
    {
      "signal_id": "SIG-5",
      "type": "unreported_shipping",
      "detected_at": "2026-09-20T09:10:00+08:00",
      "summary": "订单 O-1006 实际发货主体 E-99 及丙市发货地址均未在报备发货主体清单内，涉嫌异地代发。",
      "order_ids": ["O-1006"]
    }
  ],
  "evidence": {
    "items": [
      {
        "evidence_id": "EV-1",
        "signal_id": "SIG-1",
        "kind": "page_snapshot_diff",
        "summary": "备案页面哈希 sha256:yangli-lv01-base 与 O-1004 履约快照 sha256:yangli-lv01-swapped 的比对差异记录，主图与生产厂家字段不同。",
        "source_ref": "page-diff://L-700123/O-1004",
        "captured_at": "2026-09-17T09:40:00+08:00"
      },
      {
        "evidence_id": "EV-2",
        "signal_id": "SIG-2",
        "kind": "trace_code_record",
        "summary": "追溯码 T1003 两次核销记录：O-1003（2026-09-15）与 O-1005（2026-09-18），分别锁定不同批次。",
        "source_ref": "trace://T1003/uses",
        "captured_at": "2026-09-19T08:55:00+08:00"
      },
      {
        "evidence_id": "EV-3",
        "signal_id": "SIG-3",
        "kind": "trace_code_record",
        "summary": "O-1005 码 T9999 在报备码段 T1001-T1100、T2001-T2060 中均无归属。",
        "source_ref": "trace://T9999/lookup",
        "captured_at": "2026-09-19T08:55:00+08:00"
      },
      {
        "evidence_id": "EV-4",
        "signal_id": "SIG-4",
        "kind": "qualification_record",
        "summary": "药品经营许可证 YAOJING-YANGLI-0002 有效期至 2026-08-31，截至处置日未查询到有效换证记录。",
        "source_ref": "qual://Q2/registry",
        "captured_at": "2026-09-02T07:00:00+08:00"
      },
      {
        "evidence_id": "EV-5",
        "signal_id": "SIG-5",
        "kind": "shipment_record",
        "summary": "O-1006 运单显示发货主体 E-99、发货地址示例省丙市城郊仓库群17号库，均不在 filing-700123-01 报备清单。",
        "source_ref": "shipment://O-1006/waybill",
        "captured_at": "2026-09-20T09:10:00+08:00"
      },
      {
        "evidence_id": "EV-6",
        "signal_id": "SIG-4",
        "kind": "merchant_material",
        "summary": "商家申诉时提交换领后的药品经营许可证，有效期至 2031-08-31，编号不变。",
        "source_ref": "appeal://A-1/material/Q2-renewed",
        "captured_at": "2026-09-21T15:20:00+08:00"
      }
    ]
  },
  "dispositions": [
    {
      "disposition_id": "D-1",
      "level": 2,
      "action": "restrict",
      "decided_at": "2026-09-19T11:00:00+08:00",
      "decided_by": "U-SUP-01",
      "evidence_ids": ["EV-2", "EV-3"],
      "rationale": "发现追溯码 T1003 跨订单重复且 T9999 无报备归属，先暂停版本 lv-700123-01 新订单，等待商家说明批次流向。",
      "scope": {
        "version_ids": ["lv-700123-01"],
        "batch_nos": ["B2026-07A", "B2026-08B"],
        "order_ids": ["O-1003", "O-1005"]
      },
      "state": "active"
    },
    {
      "disposition_id": "D-2",
      "level": 3,
      "action": "delist",
      "decided_at": "2026-09-20T17:30:00+08:00",
      "decided_by": "U-LEAD-01",
      "evidence_ids": ["EV-1", "EV-2", "EV-3", "EV-4", "EV-5"],
      "rationale": "页面替换（EV-1）、重复追溯码（EV-2）、越界追溯码（EV-3）、许可证过期（EV-4）与未报备异地代发（EV-5）五类证据相互印证，对版本 lv-700123-01 作下架处置。",
      "scope": {
        "version_ids": ["lv-700123-01"],
        "batch_nos": ["B2026-07A", "B2026-08B"],
        "order_ids": ["O-1003", "O-1004", "O-1005", "O-1006"]
      },
      "state": "active"
    }
  ],
  "appeals": [
    {
      "appeal_id": "A-1",
      "disposition_id": "D-2",
      "filed_at": "2026-09-21T15:20:00+08:00",
      "grounds": "商家称许可证 Q2 已完成换领，其余信号系串码录入与第三方仓临时调拨的误会，申请恢复上架。",
      "merchant_material_refs": ["EV-6"],
      "status": "adjusted"
    }
  ],
  "reviews": [
    {
      "review_id": "RV-1",
      "appeal_id": "A-1",
      "reviewer_role": "compliance_lead",
      "reviewed_at": "2026-09-22T10:00:00+08:00",
      "conclusion": "adjust",
      "notes": "换证材料 EV-6 属实，SIG-4 对应问题关闭；但 EV-1/EV-2/EV-3/EV-5 未经反驳，D-2 下架维持，恢复条件更新后送达商家。"
    }
  ],
  "regulator_notifications": [
    {
      "notice_id": "RN-1",
      "sent_at": "2026-09-20T18:30:00+08:00",
      "authority": "示例省甲市药品监督管理局网络交易监管科（虚构）",
      "summary": "移送康泽大药房自费慢病药链接 L-700123 的页面替换、重复/越界追溯码、未报备异地代发线索及相关订单范围。",
      "signal_ids": ["SIG-1", "SIG-2", "SIG-3", "SIG-5"]
    }
  ],
  "buyer_notifications": [
    {
      "notice_id": "BN-1",
      "sent_at": "2026-09-20T19:00:00+08:00",
      "batch_no": "B2026-07A",
      "order_ids": ["O-1001", "O-1003", "O-1004"],
      "summary": "您购买批次 B2026-07A 的来源核查正在进行：如您的药品追溯码为 T1003 或收到的商品页面与下单时不一致，请暂停使用并通过订单页申请核验或退换（虚构告知模板）。"
    },
    {
      "notice_id": "BN-2",
      "sent_at": "2026-09-20T19:05:00+08:00",
      "batch_no": "B2026-08B",
      "order_ids": ["O-1002", "O-1005", "O-1006"],
      "summary": "您购买批次 B2026-08B 的来源核查正在进行：若运单发货地为丙市或追溯码查无归属，请通过订单页申请核验或退换（虚构告知模板）。"
    }
  ],
  "relist_attempts": [
    {
      "attempt_id": "RA-1",
      "old_listing_id": "L-700123",
      "requested_at": "2026-09-23T09:30:00+08:00",
      "result": "blocked",
      "blocking_reasons": [
        "下架处置 D-2 仍处于 active 状态",
        "未解决问题 ISS-1、ISS-2、ISS-3、ISS-4 仍为 open",
        "恢复条件 RC-1、RC-2、RC-3 尚未满足"
      ]
    }
  ],
  "unresolved_issues": [
    {
      "issue_id": "ISS-1",
      "signal_id": "SIG-1",
      "description": "O-1004 页面替换的替换商品来源与影响订单范围未查清。",
      "status": "open"
    },
    {
      "issue_id": "ISS-2",
      "signal_id": "SIG-2",
      "description": "重复追溯码 T1003 的真实流向与问题库存数量未核销。",
      "status": "open"
    },
    {
      "issue_id": "ISS-3",
      "signal_id": "SIG-3",
      "description": "越界码 T9999 药品来源未说明。",
      "status": "open"
    },
    {
      "issue_id": "ISS-4",
      "signal_id": "SIG-5",
      "description": "未报备主体 E-99 丙市仓库的资质与代发订单范围未核实。",
      "status": "open"
    },
    {
      "issue_id": "ISS-5",
      "signal_id": "SIG-4",
      "description": "药品经营许可证 Q2 过期。",
      "status": "resolved"
    }
  ],
  "recovery_conditions": [
    {
      "condition_id": "RC-1",
      "description": "提交重复追溯码 T1003 完整流向说明，召回或核销问题库存并提供回执。",
      "satisfied": false
    },
    {
      "condition_id": "RC-2",
      "description": "恢复备案页面版本，对 O-1004 等页面替换订单完成一对一告知与退换方案确认。",
      "satisfied": false
    },
    {
      "condition_id": "RC-3",
      "description": "补充 E-99 发货主体经营资质与授权链，或将相关订单改由已报备主体发货。",
      "satisfied": false
    },
    {
      "condition_id": "RC-4",
      "description": "提交换领后的有效药品经营许可证。",
      "satisfied": true
    }
  ],
  "access_log": [
    {
      "entry_id": "AL-1",
      "actor_id": "U-REV-01",
      "role": "reviewer",
      "action": "view_case_detail",
      "case_scoped": true,
      "buyer_refs_accessed": ["B-CHARLIE", "B-DELTA", "B-ECHO", "B-FOXTROT"],
      "accessed_at": "2026-09-20T17:35:00+08:00"
    },
    {
      "entry_id": "AL-2",
      "actor_id": "U-REV-01",
      "role": "reviewer",
      "action": "attempt_view_buyer_contact_outside_scope",
      "case_scoped": false,
      "buyer_refs_accessed": [],
      "accessed_at": "2026-09-20T17:40:00+08:00"
    },
    {
      "entry_id": "AL-3",
      "actor_id": "U-SUP-01",
      "role": "supervisor",
      "action": "review_disposition",
      "case_scoped": true,
      "buyer_refs_accessed": ["B-CHARLIE", "B-DELTA", "B-ECHO", "B-FOXTROT"],
      "accessed_at": "2026-09-22T09:50:00+08:00"
    },
    {
      "entry_id": "AL-4",
      "actor_id": "U-LEAD-02",
      "role": "compliance_lead",
      "action": "export_anonymized_notice_list",
      "case_scoped": true,
      "buyer_refs_accessed": [],
      "accessed_at": "2026-09-22T10:30:00+08:00"
    }
  ]
}
